{
  "checks": {
    "cleanup_mapping": true,
    "duplex_remote_admission": true,
    "effect_protocol_exact": true,
    "full_manifest_validator": true,
    "local_assembly_before_effects": true,
    "map_schema_valid": true,
    "phase_specific_host_operations": true,
    "post_entry_host_transfer": true,
    "protocol_surface_exact": true,
    "shared_phase_order_exact": true,
    "single_launch_mutation_seam": true,
    "sole_authoritative_accountant": true,
    "synthetic_successor_compatible": true,
    "transcript_evidence_binding": true
  },
  "complete": true,
  "effect_protocol_version": "2.0.0",
  "findings": [],
  "live_environment_required": false,
  "method_map_bytes": 23486,
  "method_map_file_sha256": "114bafd02b5ce3f2434ec055274282a4273c67be34bce946450d8b1d72af45f6",
  "method_map_path": "control/live-method-map.json",
  "method_map_semantic_sha256": "22efa943168f1a69323a0194dc9f973615a42fe0a38b367969573bc348691e41",
  "methods": [
    {
      "accounting_owner": "not-applicable",
      "authority_owner": "shared held package loader",
      "evidence_owner": "shared source binding",
      "input_type": "property access",
      "live_mapping_complete": true,
      "method_name": "effect_protocol_version",
      "output_type": "str",
      "phase": "exact identity and composition",
      "post_repair_classification": "maps directly to one retained live primitive",
      "pre_repair_classification": "historical compatibility only",
      "retained_primitive": "EFFECT_PROTOCOL_VERSION exact registration validation",
      "shared_caller": "load_package_effects and ProductionCategory3World.__init__"
    },
    {
      "accounting_owner": "not-applicable",
      "authority_owner": "shared target resolver",
      "evidence_owner": "registry and composition",
      "input_type": "property access",
      "live_mapping_complete": true,
      "method_name": "provider_contract_version",
      "output_type": "str",
      "phase": "exact identity and composition",
      "post_repair_classification": "maps directly to one retained live primitive",
      "pre_repair_classification": "maps directly to one retained live primitive",
      "retained_primitive": "T09ProviderContract exact selector",
      "shared_caller": "ProductionCategory3World.__init__"
    },
    {
      "accounting_owner": "not-applicable",
      "authority_owner": "shared held package loader",
      "evidence_owner": "shared source binding",
      "input_type": "property access",
      "live_mapping_complete": true,
      "method_name": "implementation_identity",
      "output_type": "EffectImplementationIdentity",
      "phase": "exact identity and composition",
      "post_repair_classification": "maps directly to one retained live primitive",
      "pre_repair_classification": "maps directly to one retained live primitive",
      "retained_primitive": "PackageEffectRegistration plus HeldEffectSource",
      "shared_caller": "load_package_effects and ProductionCategory3World.__init__"
    },
    {
      "accounting_owner": "shared controller",
      "authority_owner": "shared validated clock wrapper",
      "evidence_owner": "shared phase receipts",
      "input_type": "property access",
      "live_mapping_complete": true,
      "method_name": "runtime_clock",
      "output_type": "RuntimeClock",
      "phase": "all deadline-bearing phases",
      "post_repair_classification": "maps directly to one retained live primitive",
      "pre_repair_classification": "maps directly to one retained live primitive",
      "retained_primitive": "time.monotonic, time.time, and bounded sleep adapter",
      "shared_caller": "ProductionCategory3World.__init__"
    },
    {
      "accounting_owner": "not-applicable",
      "authority_owner": "shared held-root derivation",
      "evidence_owner": "shared root attestation",
      "input_type": "property access",
      "live_mapping_complete": true,
      "method_name": "transaction_root",
      "output_type": "Path",
      "phase": "exact identity and composition",
      "post_repair_classification": "maps directly to one retained live primitive",
      "pre_repair_classification": "maps directly to one retained live primitive",
      "retained_primitive": "HeldTransactionRoot.path",
      "shared_caller": "ProductionCategory3World.__init__"
    },
    {
      "accounting_owner": "shared effect counters",
      "authority_owner": "shared reserved opaque authority",
      "evidence_owner": "privacy-safe secret-channel receipt",
      "input_type": "held package-private secret path",
      "live_mapping_complete": true,
      "method_name": "read_model_secret",
      "output_type": "bytearray",
      "phase": "exact secret reads",
      "post_repair_classification": "maps directly to one retained live primitive",
      "pre_repair_classification": "maps directly to one retained live primitive",
      "retained_primitive": "load_openai_dotenv_assignment strict mixed-dotenv selector",
      "shared_caller": "ProductionCategory3World.read"
    },
    {
      "accounting_owner": "shared effect counters",
      "authority_owner": "shared reserved opaque authority",
      "evidence_owner": "privacy-safe secret-channel receipt",
      "input_type": "held package-private secret path",
      "live_mapping_complete": true,
      "method_name": "read_provider_secret",
      "output_type": "bytearray",
      "phase": "exact secret reads",
      "post_repair_classification": "maps directly to one retained live primitive",
      "pre_repair_classification": "maps directly to one retained live primitive",
      "retained_primitive": "load_openai_dotenv_assignment strict LAMBDA_API_KEY selector",
      "shared_caller": "ProductionCategory3World.read"
    },
    {
      "accounting_owner": "shared provider request ledger",
      "authority_owner": "shared launch transaction",
      "evidence_owner": "retained provider lifecycle source",
      "input_type": "explicit public observation channel",
      "live_mapping_complete": true,
      "method_name": "public_ipv4",
      "output_type": "str",
      "phase": "provider inventory and launch",
      "post_repair_classification": "maps directly to one retained live primitive",
      "pre_repair_classification": "maps directly to one retained live primitive",
      "retained_primitive": "retained provider public-source IPv4 acquisition",
      "shared_caller": "ProductionCategory3World.read"
    },
    {
      "accounting_owner": "not-applicable",
      "authority_owner": "shared launch transaction",
      "evidence_owner": "retained provider launch manifest",
      "input_type": "held public-key path",
      "live_mapping_complete": true,
      "method_name": "ssh_public_key",
      "output_type": "str",
      "phase": "provider inventory and launch",
      "post_repair_classification": "maps directly to one retained live primitive",
      "pre_repair_classification": "maps directly to one retained live primitive",
      "retained_primitive": "retained exact SSH public-key loader",
      "shared_caller": "ProductionCategory3World.read"
    },
    {
      "accounting_owner": "shared metadata controller",
      "authority_owner": "shared opaque authority transaction",
      "evidence_owner": "model metadata receipt",
      "input_type": "model ID, mutable credential, wall time",
      "live_mapping_complete": true,
      "method_name": "metadata_channel",
      "output_type": "ModelMetadataResponse",
      "phase": "sole authenticated metadata request",
      "post_repair_classification": "maps directly to one retained live primitive",
      "pre_repair_classification": "maps directly to one retained live primitive",
      "retained_primitive": "one no-redirect no-retry model metadata GET transport",
      "shared_caller": "ProductionCategory3World.request"
    },
    {
      "accounting_owner": "shared metadata controller",
      "authority_owner": "shared opaque authority transaction",
      "evidence_owner": "provider-entry authority closure",
      "input_type": "T09ProviderContract",
      "live_mapping_complete": true,
      "method_name": "metadata_authorization_binding",
      "output_type": "Mapping[str, object]",
      "phase": "sole authenticated metadata request",
      "post_repair_classification": "maps directly to one retained live primitive",
      "pre_repair_classification": "maps directly to one retained live primitive",
      "retained_primitive": "validate_model_metadata_receipt authorization binding",
      "shared_caller": "ProductionCategory3World.request"
    },
    {
      "accounting_owner": "shared provider request ledger",
      "authority_owner": "shared provider lifecycle",
      "evidence_owner": "provider lifecycle transaction",
      "input_type": "explicit retained provider transport",
      "live_mapping_complete": true,
      "method_name": "provider_inventory",
      "output_type": "tuple[str, ...] | None",
      "phase": "provider inventory and terminal verification",
      "post_repair_classification": "maps directly to one retained live primitive",
      "pre_repair_classification": "maps directly to one retained live primitive",
      "retained_primitive": "t09_pragmatic_provider bounded inventory observations",
      "shared_caller": "ProductionCategory3World.launch and cleanup"
    },
    {
      "accounting_owner": "shared provider request ledger",
      "authority_owner": "shared provider lifecycle",
      "evidence_owner": "provider-entry source bundle",
      "input_type": "ProviderHandle",
      "live_mapping_complete": true,
      "method_name": "provider_entry",
      "output_type": "None",
      "phase": "provider entry validation",
      "post_repair_classification": "maps directly to one retained live primitive",
      "pre_repair_classification": "maps directly to one retained live primitive",
      "retained_primitive": "validate_entry_receipt_source_bound and exact host entry",